vllm/model_executor/layers/fused_moe/configs/E=8,N=1792,device_name=AMD_Instinct_MI300X_OAM.json
{
    "1": {
        "BLOCK_SIZE_M": 16,
        "BLOCK_SIZE_N": 32,
        "BLOCK_SIZE_K": 32,
        "GROUP_SIZE_M": 1,
        "num_warps": 2,
        "num_stages": 0,
        "waves_per_eu": 0,
        "matrix_instr_nonkdim": 16,
        "kpack": 1
    },
    "2": {
        "BLOCK_SIZE_M": 16,
        "BLOCK_SIZE_N": 16,
        "BLOCK_SIZE_K": 128,
        "GROUP_SIZE_M": 1,
        "num_warps": 1,
        "num_stages": 0,
        "waves_per_eu": 0,
        "matrix_instr_nonkdim": 16,
        "kpack": 1
    },
    "4": {
        "BLOCK_SIZE_M": 32,
        "BLOCK_SIZE_N": 128,
        "BLOCK_SIZE_K": 128,
        "GROUP_SIZE_M": 1,
        "num_warps": 16,
        "num_stages": 0,
        "waves_per_eu": 0,
        "matrix_instr_nonkdim": 16,
        "kpack": 2
    },
    "8": {
        "BLOCK_SIZE_M": 16,
        "BLOCK_SIZE_N": 64,
        "BLOCK_SIZE_K": 128,
        "GROUP_SIZE_M": 1,
        "num_warps": 4,
        "num_stages": 0,
        "waves_per_eu": 0,
        "matrix_instr_nonkdim": 16,
        "kpack": 1
    },
    "16": {
        "BLOCK_SIZE_M": 16,
        "BLOCK_SIZE_N": 128,
        "BLOCK_SIZE_K": 128,
        "GROUP_SIZE_M": 1,
        "num_warps": 4,
        "num_stages": 0,
        "waves_per_eu": 0,
        "matrix_instr_nonkdim": 16,
        "kpack": 2
    },
    "24": {
        "BLOCK_SIZE_M": 32,
        "BLOCK_SIZE_N": 128,
        "BLOCK_SIZE_K": 64,
        "GROUP_SIZE_M": 1,
        "num_warps": 8,
        "num_stages": 0,
        "waves_per_eu": 0,
        "matrix_instr_nonkdim": 16,
        "kpack": 2
    },
    "32": {
        "BLOCK_SIZE_M": 16,
        "BLOCK_SIZE_N": 128,
        "BLOCK_SIZE_K": 128,
        "GROUP_SIZE_M": 1,
        "num_warps": 8,
        "num_stages": 0,
        "waves_per_eu": 0,
        "matrix_instr_nonkdim": 16,
        "kpack": 1
    },
    "40": {
        "BLOCK_SIZE_M": 16,
        "BLOCK_SIZE_N": 64,
        "BLOCK_SIZE_K": 128,
        "GROUP_SIZE_M": 1,
        "num_warps": 4,
        "num_stages": 0,
        "waves_per_eu": 0,
        "matrix_instr_nonkdim": 16,
        "kpack": 1
    },
    "48": {
        "BLOCK_SIZE_M": 16,
        "BLOCK_SIZE_N": 128,
        "BLOCK_SIZE_K": 128,
        "GROUP_SIZE_M": 1,
        "num_warps": 8,
        "num_stages": 0,
        "waves_per_eu": 0,
        "matrix_instr_nonkdim": 16,
        "kpack": 1
    },
    "56": {
        "BLOCK_SIZE_M": 16,
        "BLOCK_SIZE_N": 128,
        "BLOCK_SIZE_K": 128,
        "GROUP_SIZE_M": 1,
        "num_warps": 8,
        "num_stages": 0,
        "waves_per_eu": 0,
        "matrix_instr_nonkdim": 16,
        "kpack": 1
    },
    "64": {
        "BLOCK_SIZE_M": 32,
        "BLOCK_SIZE_N": 128,
        "BLOCK_SIZE_K": 128,
        "GROUP_SIZE_M": 1,
        "num_warps": 8,
        "num_stages": 0,
        "waves_per_eu": 0,
        "matrix_instr_nonkdim": 16,
        "kpack": 2
    },
    "72": {
        "BLOCK_SIZE_M": 32,
        "BLOCK_SIZE_N": 128,
        "BLOCK_SIZE_K": 128,
        "GROUP_SIZE_M": 1,
        "num_warps": 16,
        "num_stages": 0,
        "waves_per_eu": 0,
        "matrix_instr_nonkdim": 16,
        "kpack": 1
    },
    "80": {
        "BLOCK_SIZE_M": 32,
        "BLOCK_SIZE_N": 128,
        "BLOCK_SIZE_K": 128,
        "GROUP_SIZE_M": 1,
        "num_warps": 8,
        "num_stages": 0,
        "waves_per_eu": 0,
        "matrix_instr_nonkdim": 16,
        "kpack": 2
    },
    "88": {
        "BLOCK_SIZE_M": 32,
        "BLOCK_SIZE_N": 128,
        "BLOCK_SIZE_K": 128,
        "GROUP_SIZE_M": 1,
        "num_warps": 8,
        "num_stages": 0,
        "waves_per_eu": 0,
        "matrix_instr_nonkdim": 16,
        "kpack": 1
    },
    "96": {
        "BLOCK_SIZE_M": 32,
        "BLOCK_SIZE_N": 128,
        "BLOCK_SIZE_K": 128,
        "GROUP_SIZE_M": 1,
        "num_warps": 8,
        "num_stages": 0,
        "waves_per_eu": 0,
        "matrix_instr_nonkdim": 16,
        "kpack": 2
    },
    "104": {
        "BLOCK_SIZE_M": 32,
        "BLOCK_SIZE_N": 128,
        "BLOCK_SIZE_K": 128,
        "GROUP_SIZE_M": 1,
        "num_warps": 8,
        "num_stages": 0,
        "waves_per_eu": 0,
        "matrix_instr_nonkdim": 16,
        "kpack": 2
    },
    "112": {
        "BLOCK_SIZE_M": 32,
        "BLOCK_SIZE_N": 128,
        "BLOCK_SIZE_K": 128,
        "GROUP_SIZE_M": 1,
        "num_warps": 8,
        "num_stages": 0,
        "waves_per_eu": 0,
        "matrix_instr_nonkdim": 16,
        "kpack": 2
    },
    "120": {
        "BLOCK_SIZE_M": 32,
        "BLOCK_SIZE_N": 64,
        "BLOCK_SIZE_K": 128,
        "GROUP_SIZE_M": 1,
        "num_warps": 8,
        "num_stages": 0,
        "waves_per_eu": 0,
        "matrix_instr_nonkdim": 16,
        "kpack": 2
    },
    "128": {
        "BLOCK_SIZE_M": 64,
        "BLOCK_SIZE_N": 128,
        "BLOCK_SIZE_K": 128,
        "GROUP_SIZE_M": 1,
        "num_warps": 8,
        "num_stages": 0,
        "waves_per_eu": 0,
        "matrix_instr_nonkdim": 16,
        "kpack": 1
    },
    "136": {
        "BLOCK_SIZE_M": 64,
        "BLOCK_SIZE_N": 128,
        "BLOCK_SIZE_K": 128,
        "GROUP_SIZE_M": 1,
        "num_warps": 16,
        "num_stages": 0,
        "waves_per_eu": 0,
        "matrix_instr_nonkdim": 16,
        "kpack": 2
    },
    "144": {
        "BLOCK_SIZE_M": 64,
        "BLOCK_SIZE_N": 128,
        "BLOCK_SIZE_K": 128,
        "GROUP_SIZE_M": 1,
        "num_warps": 8,
        "num_stages": 0,
        "waves_per_eu": 0,
        "matrix_instr_nonkdim": 16,
        "kpack": 1
    },
    "152": {
        "BLOCK_SIZE_M": 64,
        "BLOCK_SIZE_N": 128,
        "BLOCK_SIZE_K": 128,
        "GROUP_SIZE_M": 1,
        "num_warps": 8,
        "num_stages": 0,
        "waves_per_eu": 0,
        "matrix_instr_nonkdim": 16,
        "kpack": 2
    },
    "160": {
        "BLOCK_SIZE_M": 64,
        "BLOCK_SIZE_N": 128,
        "BLOCK_SIZE_K": 128,
        "GROUP_SIZE_M": 1,
        "num_warps": 8,
        "num_stages": 0,
        "waves_per_eu": 0,
        "matrix_instr_nonkdim": 16,
        "kpack": 2
    },
    "168": {
        "BLOCK_SIZE_M": 64,
        "BLOCK_SIZE_N": 128,
        "BLOCK_SIZE_K": 128,
        "GROUP_SIZE_M": 1,
        "num_warps": 8,
        "num_stages": 0,
        "waves_per_eu": 0,
        "matrix_instr_nonkdim": 16,
        "kpack": 2
    },
    "176": {
        "BLOCK_SIZE_M": 64,
        "BLOCK_SIZE_N": 128,
        "BLOCK_SIZE_K": 128,
        "GROUP_SIZE_M": 1,
        "num_warps": 8,
        "num_stages": 0,
        "waves_per_eu": 0,
        "matrix_instr_nonkdim": 16,
        "kpack": 2
    },
    "184": {
        "BLOCK_SIZE_M": 64,
        "BLOCK_SIZE_N": 128,
        "BLOCK_SIZE_K": 128,
        "GROUP_SIZE_M": 1,
        "num_warps": 8,
        "num_stages": 0,
        "waves_per_eu": 0,
        "matrix_instr_nonkdim": 16,
        "kpack": 2
    },
    "192": {
        "BLOCK_SIZE_M": 64,
        "BLOCK_SIZE_N": 128,
        "BLOCK_SIZE_K": 128,
        "GROUP_SIZE_M": 1,
        "num_warps": 8,
        "num_stages": 0,
        "waves_per_eu": 0,
        "matrix_instr_nonkdim": 16,
        "kpack": 2
    },
    "200": {
        "BLOCK_SIZE_M": 64,
        "BLOCK_SIZE_N": 128,
        "BLOCK_SIZE_K": 128,
        "GROUP_SIZE_M": 1,
        "num_warps": 8,
        "num_stages": 0,
        "waves_per_eu": 0,
        "matrix_instr_nonkdim": 16,
        "kpack": 2
    },
    "208": {
        "BLOCK_SIZE_M": 64,
        "BLOCK_SIZE_N": 128,
        "BLOCK_SIZE_K": 128,
        "GROUP_SIZE_M": 1,
        "num_warps": 8,
        "num_stages": 0,
        "waves_per_eu": 0,
        "matrix_instr_nonkdim": 16,
        "kpack": 2
    },
    "216": {
        "BLOCK_SIZE_M": 64,
        "BLOCK_SIZE_N": 128,
        "BLOCK_SIZE_K": 128,
        "GROUP_SIZE_M": 1,
        "num_warps": 8,
        "num_stages": 0,
        "waves_per_eu": 0,
        "matrix_instr_nonkdim": 16,
        "kpack": 2
    },
    "224": {
        "BLOCK_SIZE_M": 64,
        "BLOCK_SIZE_N": 128,
        "BLOCK_SIZE_K": 128,
        "GROUP_SIZE_M": 1,
        "num_warps": 8,
        "num_stages": 0,
        "waves_per_eu": 0,
        "matrix_instr_nonkdim": 16,
        "kpack": 2
    },
    "232": {
        "BLOCK_SIZE_M": 64,
        "BLOCK_SIZE_N": 128,
        "BLOCK_SIZE_K": 128,
        "GROUP_SIZE_M": 1,
        "num_warps": 8,
        "num_stages": 0,
        "waves_per_eu": 0,
        "matrix_instr_nonkdim": 16,
        "kpack": 1
    },
    "240": {
        "BLOCK_SIZE_M": 64,
        "BLOCK_SIZE_N": 128,
        "BLOCK_SIZE_K": 128,
        "GROUP_SIZE_M": 1,
        "num_warps": 16,
        "num_stages": 0,
        "waves_per_eu": 0,
        "matrix_instr_nonkdim": 16,
        "kpack": 2
    },
    "248": {
        "BLOCK_SIZE_M": 64,
        "BLOCK_SIZE_N": 128,
        "BLOCK_SIZE_K": 128,
        "GROUP_SIZE_M": 1,
        "num_warps": 16,
        "num_stages": 0,
        "waves_per_eu": 0,
        "matrix_instr_nonkdim": 16,
        "kpack": 2
    },
    "256": {
        "BLOCK_SIZE_M": 64,
        "BLOCK_SIZE_N": 64,
        "BLOCK_SIZE_K": 64,
        "GROUP_SIZE_M": 1,
        "num_warps": 8,
        "num_stages": 0,
        "waves_per_eu": 0,
        "matrix_instr_nonkdim": 16,
        "kpack": 1
    },
    "2500": {
        "BLOCK_SIZE_M": 128,
        "BLOCK_SIZE_N": 128,
        "BLOCK_SIZE_K": 64,
        "GROUP_SIZE_M": 1,
        "num_warps": 8,
        "num_stages": 0,
        "waves_per_eu": 0,
        "matrix_instr_nonkdim": 16,
        "kpack": 2
    },
    "4400": {
        "BLOCK_SIZE_M": 128,
        "BLOCK_SIZE_N": 128,
        "BLOCK_SIZE_K": 64,
        "GROUP_SIZE_M": 1,
        "num_warps": 8,
        "num_stages": 0,
        "waves_per_eu": 0,
        "matrix_instr_nonkdim": 16,
        "kpack": 2
    },
    "6000": {
        "BLOCK_SIZE_M": 128,
        "BLOCK_SIZE_N": 128,
        "BLOCK_SIZE_K": 64,
        "GROUP_SIZE_M": 1,
        "num_warps": 8,
        "num_stages": 0,
        "waves_per_eu": 0,
        "matrix_instr_nonkdim": 16,
        "kpack": 2
    },
    "7500": {
        "BLOCK_SIZE_M": 256,
        "BLOCK_SIZE_N": 256,
        "BLOCK_SIZE_K": 32,
        "GROUP_SIZE_M": 1,
        "num_warps": 16,
        "num_stages": 0,
        "waves_per_eu": 0,
        "matrix_instr_nonkdim": 16,
        "kpack": 1
    },
    "8800": {
        "BLOCK_SIZE_M": 256,
        "BLOCK_SIZE_N": 256,
        "BLOCK_SIZE_K": 32,
        "GROUP_SIZE_M": 1,
        "num_warps": 16,
        "num_stages": 0,
        "waves_per_eu": 0,
        "matrix_instr_nonkdim": 16,
        "kpack": 1
    },
    "10000": {
        "BLOCK_SIZE_M": 256,
        "BLOCK_SIZE_N": 256,
        "BLOCK_SIZE_K": 32,
        "GROUP_SIZE_M": 1,
        "num_warps": 16,
        "num_stages": 0,
        "waves_per_eu": 0,
        "matrix_instr_nonkdim": 16,
        "kpack": 1
    },
    "11000": {
        "BLOCK_SIZE_M": 256,
        "BLOCK_SIZE_N": 256,
        "BLOCK_SIZE_K": 32,
        "GROUP_SIZE_M": 1,
        "num_warps": 16,
        "num_stages": 0,
        "waves_per_eu": 0,
        "matrix_instr_nonkdim": 16,
        "kpack": 1
    },
    "12000": {
        "BLOCK_SIZE_M": 128,
        "BLOCK_SIZE_N": 128,
        "BLOCK_SIZE_K": 64,
        "GROUP_SIZE_M": 1,
        "num_warps": 8,
        "num_stages": 0,
        "waves_per_eu": 0,
        "matrix_instr_nonkdim": 16,
        "kpack": 2
    },
    "13200": {
        "BLOCK_SIZE_M": 256,
        "BLOCK_SIZE_N": 256,
        "BLOCK_SIZE_K": 32,
        "GROUP_SIZE_M": 1,
        "num_warps": 16,
        "num_stages": 0,
        "waves_per_eu": 0,
        "matrix_instr_nonkdim": 16,
        "kpack": 1
    },
    "15000": {
        "BLOCK_SIZE_M": 256,
        "BLOCK_SIZE_N": 256,
        "BLOCK_SIZE_K": 32,
        "GROUP_SIZE_M": 1,
        "num_warps": 16,
        "num_stages": 0,
        "waves_per_eu": 0,
        "matrix_instr_nonkdim": 16,
        "kpack": 1
    },
    "17600": {
        "BLOCK_SIZE_M": 256,
        "BLOCK_SIZE_N": 256,
        "BLOCK_SIZE_K": 32,
        "GROUP_SIZE_M": 1,
        "num_warps": 16,
        "num_stages": 0,
        "waves_per_eu": 0,
        "matrix_instr_nonkdim": 16,
        "kpack": 1
    },
    "18000": {
        "BLOCK_SIZE_M": 256,
        "BLOCK_SIZE_N": 256,
        "BLOCK_SIZE_K": 32,
        "GROUP_SIZE_M": 1,
        "num_warps": 16,
        "num_stages": 0,
        "waves_per_eu": 0,
        "matrix_instr_nonkdim": 16,
        "kpack": 1
    },
    "20000": {
        "BLOCK_SIZE_M": 256,
        "BLOCK_SIZE_N": 256,
        "BLOCK_SIZE_K": 32,
        "GROUP_SIZE_M": 1,
        "num_warps": 16,
        "num_stages": 0,
        "waves_per_eu": 0,
        "matrix_instr_nonkdim": 16,
        "kpack": 1
    },
    "22000": {
        "BLOCK_SIZE_M": 256,
        "BLOCK_SIZE_N": 256,
        "BLOCK_SIZE_K": 32,
        "GROUP_SIZE_M": 1,
        "num_warps": 16,
        "num_stages": 0,
        "waves_per_eu": 0,
        "matrix_instr_nonkdim": 16,
        "kpack": 1
    },
    "22500": {
        "BLOCK_SIZE_M": 256,
        "BLOCK_SIZE_N": 256,
        "BLOCK_SIZE_K": 32,
        "GROUP_SIZE_M": 1,
        "num_warps": 16,
        "num_stages": 0,
        "waves_per_eu": 0,
        "matrix_instr_nonkdim": 16,
        "kpack": 1
    },
    "24000": {
        "BLOCK_SIZE_M": 256,
        "BLOCK_SIZE_N": 256,
        "BLOCK_SIZE_K": 32,
        "GROUP_SIZE_M": 1,
        "num_warps": 16,
        "num_stages": 0,
        "waves_per_eu": 0,
        "matrix_instr_nonkdim": 16,
        "kpack": 1
    },
    "26400": {
        "BLOCK_SIZE_M": 256,
        "BLOCK_SIZE_N": 256,
        "BLOCK_SIZE_K": 32,
        "GROUP_SIZE_M": 1,
        "num_warps": 16,
        "num_stages": 0,
        "waves_per_eu": 0,
        "matrix_instr_nonkdim": 16,
        "kpack": 1
    },
    "27500": {
        "BLOCK_SIZE_M": 256,
        "BLOCK_SIZE_N": 256,
        "BLOCK_SIZE_K": 32,
        "GROUP_SIZE_M": 1,
        "num_warps": 16,
        "num_stages": 0,
        "waves_per_eu": 0,
        "matrix_instr_nonkdim": 16,
        "kpack": 1
    },
    "30000": {
        "BLOCK_SIZE_M": 256,
        "BLOCK_SIZE_N": 256,
        "BLOCK_SIZE_K": 32,
        "GROUP_SIZE_M": 1,
        "num_warps": 16,
        "num_stages": 0,
        "waves_per_eu": 0,
        "matrix_instr_nonkdim": 16,
        "kpack": 1
    },
    "30800": {
        "BLOCK_SIZE_M": 256,
        "BLOCK_SIZE_N": 256,
        "BLOCK_SIZE_K": 32,
        "GROUP_SIZE_M": 1,
        "num_warps": 16,
        "num_stages": 0,
        "waves_per_eu": 0,
        "matrix_instr_nonkdim": 16,
        "kpack": 1
    },
    "32500": {
        "BLOCK_SIZE_M": 256,
        "BLOCK_SIZE_N": 256,
        "BLOCK_SIZE_K": 32,
        "GROUP_SIZE_M": 1,
        "num_warps": 16,
        "num_stages": 0,
        "waves_per_eu": 0,
        "matrix_instr_nonkdim": 16,
        "kpack": 1
    },
    "32768": {
        "BLOCK_SIZE_M": 256,
        "BLOCK_SIZE_N": 256,
        "BLOCK_SIZE_K": 32,
        "GROUP_SIZE_M": 1,
        "num_warps": 16,
        "num_stages": 0,
        "waves_per_eu": 0,
        "matrix_instr_nonkdim": 16,
        "kpack": 1
    }
}