vllm/model_executor/layers/fused_moe/configs/E=8,N=4096,device_name=AMD_Instinct_MI300X,dtype=float8.json
{
    "8": {
        "BLOCK_SIZE_M": 16,
        "BLOCK_SIZE_N": 128,
        "BLOCK_SIZE_K": 256,
        "GROUP_SIZE_M": 1,
        "num_warps": 8,
        "num_stages": 0,
        "waves_per_eu": 0,
        "matrix_instr_nonkdim": 16,
        "kpack": 2
    },
    "8192": {
        "BLOCK_SIZE_M": 64,
        "BLOCK_SIZE_N": 128,
        "BLOCK_SIZE_K": 256,
        "GROUP_SIZE_M": 1,
        "num_warps": 8,
        "num_stages": 0,
        "waves_per_eu": 2,
        "matrix_instr_nonkdim": 16,
        "kpack": 2
    },
    "1": {
        "BLOCK_SIZE_M": 16,
        "BLOCK_SIZE_N": 128,
        "BLOCK_SIZE_K": 256,
        "GROUP_SIZE_M": 1,
        "num_warps": 8,
        "num_stages": 0,
        "waves_per_eu": 1,
        "matrix_instr_nonkdim": 16,
        "kpack": 2
    },
    "2": {
        "BLOCK_SIZE_M": 16,
        "BLOCK_SIZE_N": 128,
        "BLOCK_SIZE_K": 256,
        "GROUP_SIZE_M": 2,
        "num_warps": 8,
        "num_stages": 0,
        "waves_per_eu": 0,
        "matrix_instr_nonkdim": 16,
        "kpack": 2
    },
    "4": {
        "BLOCK_SIZE_M": 16,
        "BLOCK_SIZE_N": 128,
        "BLOCK_SIZE_K": 256,
        "GROUP_SIZE_M": 2,
        "num_warps": 8,
        "num_stages": 0,
        "waves_per_eu": 0,
        "matrix_instr_nonkdim": 16,
        "kpack": 2
    }
}
