benchmarks/invk1.json
{
    "4": {
        "BLOCK_SIZE_M": 16,
        "BLOCK_SIZE_N": 32,
        "BLOCK_SIZE_K": 128,
        "GROUP_SIZE_M": 1,
        "num_warps": 2,
        "num_stages": 0,
        "waves_per_eu": 0,
        "matrix_instr_nonkdim": 16,
        "kpack": 2,
        "time": 751.5060424804688
    },

    "256": {
        "BLOCK_SIZE_M": 64,
        "BLOCK_SIZE_N": 128,
        "BLOCK_SIZE_K": 128,
        "GROUP_SIZE_M": 1,
        "num_warps": 8,
        "num_stages": 0,
        "waves_per_eu": 0,
        "matrix_instr_nonkdim": 32,
        "kpack": 2,
        "time": 1863
    },

    "50": {
        "BLOCK_SIZE_M": 16,
        "BLOCK_SIZE_N": 64,
        "BLOCK_SIZE_K": 128,
        "GROUP_SIZE_M": 4,
        "num_warps": 4,
        "num_stages": 0,
        "waves_per_eu": 0,
        "matrix_instr_nonkdim": 16,
        "kpack": 2,
        "time": 772
    },

    "100": {
        "BLOCK_SIZE_M": 32,
        "BLOCK_SIZE_N": 64,
        "BLOCK_SIZE_K": 128,
        "GROUP_SIZE_M": 4,
        "num_warps": 8,
        "num_stages": 0,
        "waves_per_eu": 0,
        "matrix_instr_nonkdim": 16,
        "kpack": 2,
        "time": 1003
    }
}

